{
  "schema_version": "argus.agent_review_worker_result.v1alpha1",
  "work_item_id": "execution-1",
  "attempt": 1,
  "generation": 1,
  "fencing_token": 1,
  "idempotency_key": "execution-1-attempt-1",
  "capability_sha256": "4cc4acf0de46d9f3121156f6816c2f63d054d490122f5d3f9b8c9e2a1a67c1da",
  "status": "succeeded",
  "report_sha256": "af7163a658ce211a9ceb6bd735e747d123808aa7ac9aaafcc625fd15375c1a6f",
  "report": {"schema_version":"argus.pi-review.v0","status":"complete"},
  "completed_at": "2026-08-20T10:00:30Z"
}
